Technology Category,Custody Type,How It Operates Internally,Main Wallets,Ideal For,Can Send/Receive on L1 (On-Chain)?,Can Send/Receive on L2 (Lightning)?,Can Send/Receive Ecash (Cashu/Fedimint)?
"1. Native Automated Lightning (Pure L2)","Non-Custodial (Self-Custody)","Opens real payment channels automatically using a Lightning Service Provider (LSP). Incorporates efficient technologies like Taproot channels and splicing. Uses trampoline routing (pathfinding delegated to LSP).","Phoenix, Breez","Daily payments while maintaining full control of your keys with zero technical friction.","Yes (via Splice-In / Splice-Out — requires on-chain confirmation)","Yes (Native — instant)","No (Can pay Ecash invoices via LN translator, but cannot hold Ecash tokens)"
"2a. Own-Node Lightning: Remote (Sovereign L2)","Non-Custodial (Self-Custody)","Does not manage channels for you: acts as a 'remote control' to connect directly to your own home node (Umbrel, RaspiBlitz, etc.). Performs source-based routing using a full network graph — no LSP dependency.","Zeus (Remote), Zap","Advanced users and sovereign node operators who manage their own liquidity.","Yes (via node's on-chain wallet)","Yes (Native — sovereign routing)","No (Can pay Ecash invoices via LN, cannot hold tokens)"
"2b. Own-Node Lightning: Embedded (LSP-Assisted L2)","Non-Custodial (Self-Custody)","Runs a lightweight embedded Lightning node on the device with LSP assistance for channel management and liquidity. Similar to Category 1 but with more user control.","Zeus (Embedded mode)","Users who want own-node sovereignty with the convenience of LSP-assisted liquidity.","Yes (via LSP splice operations)","Yes (Native — LSP-assisted routing)","No (Can pay Ecash invoices via LN)"
"3. Hybrid On-Chain / Swaps (L1 with LN Connector)","Non-Custodial (2-of-2 Multisig)","Your funds are always stored on-chain as UTXOs in a 2-of-2 multisig (device key + server key). When paying on Lightning, performs a Submarine Swap using a Swap Provider. For small amounts, fees are optimized via batched settlement. Neither party can move funds unilaterally. Emergency Kit allows full recovery without servers.","Muun","Users who prefer a unified on-chain balance and use Lightning occasionally.","Yes (Native — funds are always on-chain)","Yes (via Submarine Swap — fees vary with congestion)","No (Can pay Ecash invoices via LN swap)"
"4. Ecash / Chaumian Mints (Privacy Layer)","Mint-Custodied (Local Bearer Tokens)","Exchanges Bitcoin for cryptographic IOUs (Ecash tokens) using blind signatures (BDHKE). The Mint holds the backing Bitcoin collateral and runs its own Lightning node. Tokens are bearer instruments stored locally — unlinkable to any transaction. Fedimint distributes trust across a federation of Guardians.","Macadamia, Fedi, Cashu.me","Mathematical privacy, absolute micro-payments, instant same-mint transfers with near-zero fees.","No (Generally — some Mints support on-chain deposits, not standard)","Yes (via Mint's LN node — Mint pays/receives invoices)","Yes (Native within same Mint — no Lightning needed. Cross-Mint requires LN)"
"5. Pure Custodial (Centralized)","Custodial (Third party holds all keys)","A company manages all nodes, channels, and keys on its own servers. In your app you only see a balance reflection (an internal IOU in their database). Intra-company transfers are pure database updates — no blockchain or Lightning involved.","Wallet of Satoshi, Strike, Satoshi Tango","Absolute beginners who want to experience Lightning speed without configuring anything.","Yes (Company handles on-chain withdrawals/deposits)","Yes (Company's LN nodes handle routing)","No (Can pay Ecash invoices via company's LN, cannot hold tokens)"
